{
  "artifact_id": "WB-00104",
  "spec_version": "1.0.0",
  "content_hash": "e7f8a9b0c1d2e3f4a5b6c7d8e9f0a1b2c3d4e5f6a7b8c9d0e1f2a3b4c5d6e7f8",
  "content_hash_algorithm": "sha-256",
  "captured_at": "2026-07-21T22:00:00Z",
  "source": {
    "retrieved_at": "2026-07-21T21:55:00Z"
  },
  "content": {
    "canonical_text": "This artifact's relationships list contains its own ID. This tests whether the application layer prevents self-references (the schema does not forbid it — enforcement is application-level per R-002).",
    "raw_format": "text",
    "word_count": 28,
    "character_count": 205
  },
  "relationships": {
    "derived_from": ["WB-00104"],
    "related_to": ["WB-00104"]
  },
  "lifecycle": "active"
}
