{
  "artifact_id": "WB-00103",
  "spec_version": "1.0.0",
  "content_hash": "d6e7f8a9b0c1d2e3f4a5b6c7d8e9f0a1b2c3d4e5f6a7b8c9d0e1f2a3b4c5d6e7",
  "content_hash_algorithm": "sha-256",
  "captured_at": "2026-07-21T21:00:00Z",
  "source": {
    "url": "https://example.de/artikel",
    "title": "Governance-Muster in KI-Systemen",
    "author": "Dr. Schmidt",
    "publisher": "DE Publications",
    "retrieved_at": "2026-07-21T20:55:00Z",
    "language": "de"
  },
  "content": {
    "canonical_text": "Dies ist ein Artikel über Governance-Muster in KI-Systemen. Der Schlüsselerkenntnis ist, dass Provenienz wichtiger ist als Speicherung.",
    "raw_format": "html",
    "word_count": 18,
    "character_count": 134
  },
  "lifecycle": "active"
}
