{
  "artifact_id": "WB-00042",
  "spec_version": "1.0.0",
  "content_hash": "b2c3d4e5f6a7b8c9d0e1f2a3b4c5d6e7f8a9b0c1d2e3f4a5b6c7d8e9f0a1b2c3",
  "content_hash_algorithm": "sha-256",
  "captured_at": "2026-07-21T16:00:00Z",
  "source": {
    "title": "Design Discussion — Extension Port Model",
    "author": "Andrew Hannah",
    "publisher": "ChatGPT",
    "retrieved_at": "2026-07-21T15:55:00Z"
  },
  "content": {
    "canonical_text": "User: How should extensions attach to Librarian?\nAssistant: Through a contract-first handshake protocol. Identity verification, capability declaration, then Owner approval.\nUser: What happens on failure?\nAssistant: SUSPENDED for drift, REVOKED for contract violation. Core remains unaffected.",
    "raw_format": "chat_export",
    "word_count": 35,
    "character_count": 232
  },
  "relationships": {
    "derived_from": ["WB-00001"]
  },
  "lifecycle": "active",
  "lifecycle_transitions": [
    {
      "from_state": "active",
      "to_state": "active",
      "timestamp": "2026-07-21T16:00:00Z",
      "reason": "Artifact created"
    }
  ]
}
