{
  "artifact_id": "WB-00102",
  "spec_version": "1.0.0",
  "content_hash": "c5d6e7f8a9b0c1d2e3f4a5b6c7d8e9f0a1b2c3d4e5f6a7b8c9d0e1f2a3b4c5d6",
  "content_hash_algorithm": "sha-256",
  "captured_at": "2026-07-21T20:00:00Z",
  "source": {
    "retrieved_at": "2026-07-21T19:55:00Z"
  },
  "content": {
    "canonical_text": "Short artifact body with word_count and character_count but no chunks. This tests the conditional allOf: if chunks are absent, word_count and character_count are optional per the schema.",
    "raw_format": "text",
    "word_count": 25,
    "character_count": 186
  },
  "lifecycle": "active"
}
