{
  "artifact_id": "WB-00050",
  "spec_version": "1.0.0",
  "content_hash": "d4e5f6a7b8c9d0e1f2a3b4c5d6e7f8a9b0c1d2e3f4a5b6c7d8e9f0a1b2c3d4e5",
  "content_hash_algorithm": "sha-256",
  "captured_at": "2026-07-21T18:00:00Z",
  "source": {
    "url": "https://example.com/updated-article",
    "title": "Updated Governance Patterns",
    "author": "Jane Doe",
    "publisher": "Example Publications",
    "retrieved_at": "2026-07-21T17:55:00Z",
    "language": "en"
  },
  "content": {
    "canonical_text": "This is an updated version of the governance patterns article with new findings.",
    "raw_format": "html",
    "word_count": 15,
    "character_count": 95
  },
  "relationships": {
    "derived_from": ["WB-00001"],
    "supersedes": ["WB-00001"],
    "related_to": ["WB-00042"],
    "referenced_in": ["session-planning-2026-07-21", "session-arch-001"]
  },
  "lifecycle": "active",
  "lifecycle_transitions": [
    {
      "from_state": "active",
      "to_state": "active",
      "timestamp": "2026-07-21T18:00:00Z",
      "reason": "Artifact created as update"
    }
  ],
  "index_references": {
    "embedding_id": "emb-wb-00050-v1",
    "search_index_id": "idx-wb-00050-v1"
  },
  "receipts": {
    "capture_receipt": "rcp-wb-00050-capture-001",
    "retrieval_receipts": [],
    "lifecycle_receipts": ["rcp-wb-00050-lifecycle-001"]
  }
}
