{
  "artifact_id": "WB-00099",
  "spec_version": "1.0.0",
  "content_hash": "c3d4e5f6a7b8c9d0e1f2a3b4c5d6e7f8a9b0c1d2e3f4a5b6c7d8e9f0a1b2c3d4",
  "content_hash_algorithm": "sha-256",
  "captured_at": "2026-07-21T17:00:00Z",
  "source": {
    "retrieved_at": "2026-07-21T16:55:00Z"
  },
  "content": {
    "canonical_text": "Minimal artifact with only required fields. Source has only retrieved_at.",
    "raw_format": "text",
    "word_count": 12,
    "character_count": 91
  },
  "lifecycle": "active"
}
